{"semantic": {"places": [], "keywords": ["televisie", "goedendag"], "people": ["jelle", "Richard Franzen"], "topics": ["introduction"], "organisations": []}, "emotions": {"detected_emotion": [], "information_state": []}, "metadata": {"people_present": ["Richard", "Jelle"], "script_id": "episode_1", "timestamp": "2016-11-18T08:35:44.566050", "lang": "nl", "scene_id": "scene_1", "location": {"geometry": {"coordinates": [35.41, 139.41], "type": "Point"}, "type": "Feature", "properties": {"name": "Tokyo, Japan"}}, "input_text": "We are looking for Richard Franzen, an American who has built a robot, he resides in Tagoyashi.", "speaker": "Jelle"}, "structure": {"adverbs": 0, "personal_pronouns": 2, "passive_sentences": 0, "active_sentences": 2, "future": 0, "word_length": 6.09, "adjective_count": 1, "non_future": 2, "negations": 0, "prepositional_phrases_count": 1, "number_of_sentences": 1, "wordcount": 11}}