{"emotions": {"detected_emotion": [], "information_state": []}, "structure": {"active_sentences": 2, "future": 0, "wordcount": 11, "prepositional_phrases_count": 1, "word_length": 6.09, "adverbs": 0, "passive_sentences": 0, "non_future": 2, "adjective_count": 1, "negations": 0, "personal_pronouns": 2, "number_of_sentences": 1}, "semantic": {"keywords": ["televisie", "goedendag"], "topics": ["introduction"], "people": ["jelle", "Richard Franzen"], "organisations": [], "places": ["Tagoyashi"]}, "metadata": {"speaker": "Jelle", "scene_id": "scene_1", "people_present": ["Richard", "Jelle"], "input_text": "We are looking for Richard Franzen an American who has built a robot. He resides in Tagoyashi.", "timestamp": "2016-11-18T08:35:44.566050", "script_id": "episode_1", "location": {"type": "Feature", "geometry": {"type": "Point", "coordinates": [35.41, 139.41]}, "properties": {"name": "Tokyo, Japan"}}, "lang": "nl"}}