{
  "structure": {
    "prepositional_phrases_count": 1,
    "adjective_count": 1,
    "non_future": 2,
    "active_sentences": 2,
    "personal_pronouns": 2,
    "word_length": 6.09,
    "negations": 0,
    "adverbs": 0,
    "passive_sentences": 0,
    "number_of_sentences": 1,
    "future": 0,
    "wordcount": 11
  },
  "metadata": {
    "speaker": "Jelle",
    "lang": "nl",
    "timestamp": "2016-11-18T08:35:44.566050",
    "input_text": "Goedendag, ik ben van de Nederlandse televisie. Mijn naam is Jelle.",
    "people_present": [
      "Richard",
      "Jelle"
    ],
    "script_id": "episode_1",
    "location": {
      "geometry": {
        "coordinates": [
          35.41,
          139.41
        ],
        "type": "Point"
      },
      "type": "Feature",
      "properties": {
        "name": "Tokyo, Japan"
      }
    },
    "scene_id": "scene_1"
  },
  "semantic": {
    "keywords": [
      "televisie",
      "goedendag"
    ],
    "organisations": [],
    "people": [
      "jelle"
    ],
    "places": [],
    "topics": [
      "introduction"
    ]
  },
  "emotions": {
    "detected_emotion": [],
    "information_state": []
  }
}